{
  "$schema": "https://json-schema.org/draft/2020-12/schema",
  "$id": "https://runlens.io/schema/results.schema.json",
  "title": "Runlens results document",
  "description": "The results JSON returned as `results` by GET /api/runs/{id}. Version 1 (no `schema_version` key) is the side-view-only document written before the rear view existed and remains valid unchanged. Version 2 adds an optional `rear_view`. See backend/results_schema.py.",
  "type": "object",
  "required": ["meta", "summary", "flags", "strides"],
  "properties": {
    "schema_version": {
      "description": "Absent means 1. Must be 2 whenever rear_view is present.",
      "enum": [1, 2]
    },
    "meta": {
      "description": "Side-view run metadata (backend/metrics.py, plus meta.confidence_gate from backend/job_runner.py). Open: fields are added over time.",
      "type": "object",
      "properties": {
        "height_cm": { "type": "number" },
        "video_file": { "type": "string" },
        "analyzed_at": { "type": "string", "format": "date-time" },
        "fps": { "type": "number" },
        "num_frames": { "type": "integer" },
        "confidence_gate": { "type": "object" },
        "view_check": { "type": "object", "description": "backend/view_check.py: side / diagonal / frontal / unknown, with shoulder_ratio." },
        "capture_notes": {
          "description": "Filming tips for next time (view_check.side_capture_notes). Never change a result.",
          "type": "array",
          "items": {
            "type": "object",
            "required": ["code", "message"],
            "properties": { "code": { "enum": ["camera_angle"] }, "message": { "type": "string" } },
            "additionalProperties": false
          }
        }
      },
      "additionalProperties": true
    },
    "summary": {
      "description": "Side-view aggregate metrics. Empty object when the side confidence gate hard-failed or nothing could be measured.",
      "type": "object",
      "properties": {
        "cadence_avg": { "type": "number" },
        "vertical_osc_avg_cm": { "type": "number" },
        "knee_angle_strike_avg_deg": { "type": ["number", "null"] },
        "foot_strike_position_avg_cm": { "type": ["number", "null"] },
        "trunk_lean_avg_deg": { "type": ["number", "null"] },
        "num_strides": { "type": "integer" },
        "num_strides_detected": { "type": "integer" },
        "cadence_confidence": { "type": "number", "minimum": 0, "maximum": 1 }
      },
      "additionalProperties": true
    },
    "flags": { "type": "array", "items": { "type": "object" } },
    "strides": { "type": "array", "items": { "type": "object" } },
    "rear_view": { "$ref": "#/$defs/rear_view" }
  },
  "additionalProperties": true,
  "if": { "required": ["rear_view"] },
  "then": {
    "required": ["schema_version"],
    "properties": { "schema_version": { "const": 2 } }
  },

  "$defs": {
    "tier": { "enum": ["low", "moderate", "high"] },

    "confidence": {
      "type": "object",
      "required": ["score", "tier"],
      "properties": {
        "score": { "type": "number", "minimum": 0, "maximum": 1 },
        "tier": { "$ref": "#/$defs/tier" }
      },
      "additionalProperties": false
    },

    "rear_view": {
      "description": "Frontal-plane metrics from an optional, independently recorded rear-view video. NOT synchronised or frame-matched with the side view; all cycle-relative quantities are % of the gait cycle (0% = that leg's initial contact). Never blocks or fails the side-view analysis.",
      "oneOf": [
        { "$ref": "#/$defs/rear_view_analysed" },
        { "$ref": "#/$defs/rear_view_pending" },
        { "$ref": "#/$defs/rear_view_failed" }
      ]
    },

    "rear_view_pending": {
      "type": "object",
      "required": ["status"],
      "properties": { "status": { "const": "processing" } },
      "additionalProperties": false
    },

    "rear_view_failed": {
      "type": "object",
      "required": ["status", "error"],
      "properties": {
        "status": { "const": "failed" },
        "error": { "type": "string" }
      },
      "additionalProperties": false
    },

    "rear_view_analysed": {
      "type": "object",
      "required": ["status", "meta", "confidence_gate", "legs", "symmetry", "curves"],
      "properties": {
        "status": { "enum": ["ok", "low_confidence", "insufficient_data"] },
        "meta": {
          "type": "object",
          "required": ["analyzed_at", "fps", "num_frames", "cycle_normalisation", "synchronized_with_side_view", "left_right_consistency", "left_right_labels_swapped"],
          "properties": {
            "metrics_version": { "description": "Absent means 1 (hip drop at mid-stance, pronation as a main metric). 2: tilt-cancelled peak hip drop, peak knee alignment, step_width, pronation under experimental. 3: hip_drop also under experimental. 4: balance score less sensitive to noise-sized knee / step-width gaps.", "enum": [1, 2, 3, 4] },
            "tilt_offset_deg": { "type": "number", "description": "Median hip-line tilt over the clip (camera roll plus standing pelvic asymmetry). Hip drop already cancels it." },
            "camera_roll_deg": { "type": "number", "description": "Median trunk angle from vertical over the clip: the camera's roll. Step width already corrects for it." },
            "size_change_ratio": { "type": "number", "minimum": 0, "description": "Runner's torso length in frame, last fifth of the clip / first fifth. Well below 1 = running away from the camera." },
            "original_fps": { "type": "number", "description": "Frame rate of the uploaded file, before any frame dropping." },
            "truncated_frames": { "type": "integer", "description": "Set when the clip hit GAIT_MAX_FRAMES: the cap that applied." },
            "frames_used": { "type": "integer", "description": "Set with truncated_frames: frames actually analysed." },
            "capture_notes": {
              "description": "Filming tips for next time (rear_confidence.capture_notes). Never change a result.",
              "type": "array",
              "items": {
                "type": "object",
                "required": ["code", "message"],
                "properties": {
                  "code": { "enum": ["moving_away", "low_fps", "camera_tilted"] },
                  "message": { "type": "string" }
                },
                "additionalProperties": false
              }
            },
            "video_file": { "type": "string" },
            "analyzed_at": { "type": "string", "format": "date-time" },
            "fps": { "type": ["number", "null"] },
            "num_frames": { "type": "integer" },
            "cycle_normalisation": { "const": "percent_gait_cycle" },
            "synchronized_with_side_view": { "const": false },
            "note": { "type": "string" },
            "left_right_consistency": { "type": "number", "minimum": 0, "maximum": 1 },
            "left_right_labels_swapped": { "type": "boolean" },
            "view_check": {
              "type": "object",
              "required": ["view", "shoulder_ratio", "frames_used"],
              "properties": {
                "view": { "enum": ["side", "diagonal", "frontal", "unknown"] },
                "shoulder_ratio": { "type": ["number", "null"] },
                "frames_used": { "type": "integer", "minimum": 0 }
              },
              "additionalProperties": false
            }
          },
          "additionalProperties": false
        },
        "confidence_gate": {
          "type": "object",
          "required": ["status", "reason", "user_message", "usable_cycles", "left_right_consistency"],
          "properties": {
            "status": { "enum": ["ok", "low_confidence", "insufficient_data"] },
            "reason": { "type": ["string", "null"] },
            "user_message": { "type": ["string", "null"] },
            "usable_cycles": {
              "type": "object",
              "required": ["left", "right"],
              "properties": {
                "left": { "type": "integer", "minimum": 0 },
                "right": { "type": "integer", "minimum": 0 }
              },
              "additionalProperties": false
            },
            "left_right_consistency": { "type": "number", "minimum": 0, "maximum": 1 }
          },
          "additionalProperties": false
        },
        "legs": {
          "type": "object",
          "required": ["left", "right"],
          "properties": {
            "left": { "$ref": "#/$defs/leg" },
            "right": { "$ref": "#/$defs/leg" }
          },
          "additionalProperties": false
        },
        "symmetry": { "$ref": "#/$defs/symmetry" },
        "curves": {
          "description": "Ensemble-average waveform per reportable leg, sampled every step_pct % of the gait cycle (21 points, 0..100). null when there is nothing reportable.",
          "oneOf": [
            { "type": "null" },
            {
              "type": "object",
              "required": ["step_pct", "unit", "left", "right"],
              "properties": {
                "step_pct": { "const": 5 },
                "unit": { "const": "deg" },
                "left": { "oneOf": [{ "type": "null" }, { "$ref": "#/$defs/leg_curves" }] },
                "right": { "oneOf": [{ "type": "null" }, { "$ref": "#/$defs/leg_curves" }] }
              },
              "additionalProperties": false
            }
          ]
        }
      },
      "additionalProperties": false
    },

    "leg": {
      "type": "object",
      "description": "metrics_version 1 legs carry hip_drop and pronation at the top level; version 2 adds step_width and moves pronation under experimental; version 3 moves hip_drop under experimental too.",
      "required": ["cycles_detected", "cycles_usable", "reportable", "knee_valgus"],
      "properties": {
        "cycles_detected": { "type": "integer", "minimum": 0 },
        "cycles_usable": { "type": "integer", "minimum": 0 },
        "reportable": { "type": "boolean" },
        "stance_pct": { "type": "number", "description": "Approximate stance phase, % of gait cycle." },
        "midstance_pct": { "type": "number", "description": "Mid-stance, % of gait cycle." },
        "hip_drop": { "$ref": "#/$defs/hip_drop_metric" },
        "knee_valgus": { "$ref": "#/$defs/knee_valgus_metric" },
        "step_width": { "$ref": "#/$defs/step_width_metric" },
        "pronation": { "$ref": "#/$defs/pronation_metric" },
        "experimental": {
          "description": "Computed but not shown or scored.",
          "type": "object",
          "properties": {
            "pronation": { "$ref": "#/$defs/pronation_metric" },
            "hip_drop": { "$ref": "#/$defs/hip_drop_metric" }
          },
          "additionalProperties": false
        }
      },
      "additionalProperties": false
    },

    "metric_unavailable": {
      "type": "object",
      "required": ["available", "reason"],
      "properties": {
        "available": { "const": false },
        "reason": { "enum": ["insufficient_data", "insufficient_cycles", "implausible", "no_frames", "no_pose_detected", "wrong_view"] }
      },
      "additionalProperties": false
    },

    "metric_available": {
      "type": "object",
      "required": ["available", "value_deg", "pattern", "window_pct", "cycles_used", "error_margin_deg", "confidence", "disclaimer"],
      "properties": {
        "available": { "const": true },
        "value_deg": { "type": "integer", "description": "Rounded to a coarse step (see rear_confidence.DISPLAY_STEP_DEG); a pattern indicator, not a precise angle." },
        "ci95_deg": { "type": "number", "minimum": 0, "description": "Half-width of a 95% bootstrap interval of the median across cycles (stride-to-stride consistency only). metrics_version 2+." },
        "pattern": { "type": "string" },
        "window_pct": {
          "description": "[start, end] of the window this was measured over, % of gait cycle. metrics_version 1: hip_drop at mid-stance (start == end), others from initial contact through mid-stance. Version 2: hip_drop and step_width over stance, knee alignment over the first 60% of stance.",
          "type": "array",
          "items": { "type": "number", "minimum": 0, "maximum": 100 },
          "minItems": 2,
          "maxItems": 2
        },
        "cycles_used": { "type": "integer", "minimum": 1 },
        "error_margin_deg": {
          "description": "Approximate +/- error vs. motion capture; null where no validated figure exists (deliberately not guessed).",
          "type": ["number", "null"]
        },
        "confidence": { "$ref": "#/$defs/confidence" },
        "disclaimer": { "type": "string" }
      },
      "additionalProperties": false
    },

    "metric_available_pct": {
      "type": "object",
      "required": ["available", "value_pct", "pattern", "window_pct", "cycles_used", "error_margin_pct", "confidence", "disclaimer"],
      "properties": {
        "available": { "const": true },
        "value_pct": { "type": "integer", "description": "% of hip width, rounded to a coarse step." },
        "ci95_pct": { "type": "number", "minimum": 0 },
        "pattern": { "type": "string" },
        "window_pct": { "type": "array", "items": { "type": "number", "minimum": 0, "maximum": 100 }, "minItems": 2, "maxItems": 2 },
        "cycles_used": { "type": "integer", "minimum": 1 },
        "error_margin_pct": { "type": ["number", "null"] },
        "confidence": { "$ref": "#/$defs/confidence" },
        "disclaimer": { "type": "string" }
      },
      "additionalProperties": false
    },

    "step_width_metric": {
      "description": "Where the stance foot lands relative to the pelvis midline, % of hip width (0 = on the midline, negative = crossover). metrics_version 2+.",
      "oneOf": [
        {
          "allOf": [
            { "$ref": "#/$defs/metric_available_pct" },
            { "properties": { "pattern": { "enum": ["typical", "narrow", "crossover"] } } }
          ]
        },
        { "$ref": "#/$defs/metric_unavailable" }
      ]
    },

    "hip_drop_metric": {
      "description": "Degrees the swing-side hip drops (positive = drop). metrics_version 1: below the stance-side hip at mid-stance. Version 2: peak during stance minus the value at that leg's initial contact.",
      "oneOf": [
        {
          "allOf": [
            { "$ref": "#/$defs/metric_available" },
            { "properties": { "pattern": { "enum": ["typical", "elevated", "pronounced"] } } }
          ]
        },
        { "$ref": "#/$defs/metric_unavailable" }
      ]
    },

    "pronation_metric": {
      "description": "Rearfoot pronation (+) / supination (-) proxy in degrees from the ankle-to-heel line vs. vertical, initial contact through mid-stance.",
      "oneOf": [
        {
          "allOf": [
            { "$ref": "#/$defs/metric_available" },
            { "properties": { "pattern": { "enum": ["neutral", "pronation_pattern", "supination_pattern"] } } }
          ]
        },
        { "$ref": "#/$defs/metric_unavailable" }
      ]
    },

    "knee_valgus_metric": {
      "description": "Frontal-plane knee valgus (+) / varus (-) in degrees, initial contact through mid-stance. Single-camera 2D knee angles can differ from motion capture by 20+ deg: a pattern indicator only. Shown as knee alignment. Rows stored before Sep 2026 carry error_margin_deg 19 (unsourced, since removed).",
      "oneOf": [
        {
          "allOf": [
            { "$ref": "#/$defs/metric_available" },
            { "properties": { "pattern": { "enum": ["neutral", "valgus_pattern", "varus_pattern"] } } }
          ]
        },
        { "$ref": "#/$defs/metric_unavailable" }
      ]
    },

    "symmetry": {
      "oneOf": [
        {
          "type": "object",
          "required": ["available", "score", "band", "components", "confidence", "disclaimer"],
          "properties": {
            "available": { "const": true },
            "score": { "type": "integer", "minimum": 0, "maximum": 100, "description": "Higher = more symmetric." },
            "band": { "enum": ["symmetric", "mild_asymmetry", "notable_asymmetry"] },
            "components": {
              "type": "object",
              "properties": {
                "hip_drop": { "type": "integer", "minimum": 0, "maximum": 100 },
                "pronation": { "type": "integer", "minimum": 0, "maximum": 100 },
                "knee_valgus": { "type": "integer", "minimum": 0, "maximum": 100 },
                "step_width": { "type": "integer", "minimum": 0, "maximum": 100 }
              },
              "additionalProperties": false,
              "minProperties": 2
            },
            "confidence": { "$ref": "#/$defs/confidence" },
            "disclaimer": { "type": "string" }
          },
          "additionalProperties": false
        },
        {
          "type": "object",
          "required": ["available", "reason"],
          "properties": {
            "available": { "const": false },
            "reason": { "type": "string" }
          },
          "additionalProperties": false
        }
      ]
    },

    "curve": {
      "type": "array",
      "minItems": 21,
      "maxItems": 21,
      "items": { "type": ["number", "null"] }
    },

    "leg_curves": {
      "type": "object",
      "required": ["hip_drop_deg", "knee_valgus_deg"],
      "properties": {
        "hip_drop_deg": { "$ref": "#/$defs/curve" },
        "pronation_deg": { "$ref": "#/$defs/curve" },
        "knee_valgus_deg": { "$ref": "#/$defs/curve" }
      },
      "additionalProperties": false
    }
  }
}
