{
  "meta": {
    "height_cm": 175,
    "video_file": "input.mp4",
    "analyzed_at": "2026-09-21T12:00:00+00:00",
    "fps": 30.0,
    "num_frames": 451,
    "confidence_gate": {
      "hard_fail": false,
      "low_confidence": false,
      "reason": null,
      "reason_metric": null,
      "detected_stride_count": 20,
      "usable_stride_count": 20,
      "computed_cadence": 171,
      "user_message": null
    }
  },
  "summary": {
    "cadence_avg": 171,
    "vertical_osc_avg_cm": 8,
    "knee_angle_strike_avg_deg": 22,
    "foot_strike_position_avg_cm": 6,
    "trunk_lean_avg_deg": 5,
    "num_strides": 20,
    "num_strides_detected": 20,
    "cadence_confidence": 0.883
  },
  "flags": [],
  "strides": [
    {
      "cadence": 171.4,
      "vertical_osc_cm": 8.1,
      "knee_angle_strike_deg": 21.5,
      "foot_strike_position_cm": 6.2,
      "trunk_lean_deg": 5.4,
      "duration_sec": 0.7,
      "stride_num": 1,
      "start_frame": 10,
      "end_frame": 31
    },
    {
      "cadence": 171.0,
      "vertical_osc_cm": 8.1,
      "knee_angle_strike_deg": 21.5,
      "foot_strike_position_cm": 6.2,
      "trunk_lean_deg": 5.4,
      "duration_sec": 0.7,
      "stride_num": 2,
      "start_frame": 31,
      "end_frame": 52
    },
    {
      "cadence": 171.70000000000002,
      "vertical_osc_cm": 8.1,
      "knee_angle_strike_deg": 21.5,
      "foot_strike_position_cm": 6.2,
      "trunk_lean_deg": 5.4,
      "duration_sec": 0.7,
      "stride_num": 3,
      "start_frame": 52,
      "end_frame": 73
    }
  ],
  "schema_version": 2,
  "rear_view": {
    "status": "ok",
    "meta": {
      "metrics_version": 4,
      "video_file": "rear.mp4",
      "analyzed_at": "2026-10-29T03:21:20.686102+00:00",
      "fps": 30.0,
      "num_frames": 330,
      "cycle_normalisation": "percent_gait_cycle",
      "synchronized_with_side_view": false,
      "note": "Rear-view results come from a separate recording and are not frame-matched to the side-view video; both are expressed as % of the gait cycle.",
      "left_right_consistency": 1.0,
      "left_right_labels_swapped": false,
      "view_check": {
        "view": "frontal",
        "shoulder_ratio": 0.8,
        "frames_used": 330
      },
      "tilt_offset_deg": 0.1,
      "camera_roll_deg": 0.0,
      "size_change_ratio": 1.0
    },
    "confidence_gate": {
      "status": "ok",
      "reason": null,
      "user_message": null,
      "usable_cycles": {
        "left": 14,
        "right": 15
      },
      "left_right_consistency": 1.0
    },
    "legs": {
      "left": {
        "cycles_detected": 14,
        "cycles_usable": 14,
        "stance_pct": 42.9,
        "midstance_pct": 19.0,
        "knee_valgus": {
          "available": true,
          "value_deg": 5,
          "pattern": "neutral",
          "window_pct": [
            0.0,
            25.7
          ],
          "cycles_used": 14,
          "ci95_deg": 0.0,
          "error_margin_deg": null,
          "confidence": {
            "score": 0.9,
            "tier": "moderate"
          },
          "disclaimer": "Whether your knee tracks inward or outward of the hip-to-ankle line early in stance. Knee angles from a single camera can differ a lot from lab measurements (studies report 20\u00b0 or more), so treat this as a pattern, not a precise angle. Best used to spot side-to-side differences and changes between sessions."
        },
        "step_width": {
          "available": true,
          "value_pct": 50,
          "pattern": "typical",
          "window_pct": [
            0.0,
            42.9
          ],
          "cycles_used": 14,
          "ci95_pct": 0.0,
          "error_margin_pct": null,
          "confidence": {
            "score": 0.9,
            "tier": "moderate"
          },
          "disclaimer": "Where your foot lands relative to the middle of your body, as a share of your hip width. Below zero means the foot crosses the midline. Best used to spot side-to-side differences and changes between sessions."
        },
        "experimental": {
          "pronation": {
            "available": true,
            "value_deg": 6,
            "pattern": "neutral",
            "window_pct": [
              0.0,
              19.0
            ],
            "cycles_used": 14,
            "ci95_deg": 0.0,
            "error_margin_deg": null,
            "confidence": {
              "score": 0.9,
              "tier": "low"
            },
            "disclaimer": "A rough proxy from the angle of your ankle-to-heel line, which is short and hard to track from a phone camera. Treat it as a pattern, not an angle. Best used to spot side-to-side differences and changes between sessions."
          },
          "hip_drop": {
            "available": true,
            "value_deg": 4,
            "pattern": "typical",
            "window_pct": [
              0.0,
              42.9
            ],
            "cycles_used": 14,
            "ci95_deg": 0.0,
            "error_margin_deg": null,
            "confidence": {
              "score": 0.9,
              "tier": "moderate"
            },
            "disclaimer": "How far your pelvis dips on the swing side between foot strike and the lowest point of stance, from a rear-view video. Measured from your own foot strike, so a slightly tilted camera doesn't count. Best used to spot side-to-side differences and changes between sessions."
          }
        },
        "reportable": true
      },
      "right": {
        "cycles_detected": 15,
        "cycles_usable": 15,
        "stance_pct": 47.6,
        "midstance_pct": 21.4,
        "knee_valgus": {
          "available": true,
          "value_deg": 15,
          "pattern": "valgus_pattern",
          "window_pct": [
            0.0,
            28.6
          ],
          "cycles_used": 15,
          "ci95_deg": 0.0,
          "error_margin_deg": null,
          "confidence": {
            "score": 0.9,
            "tier": "moderate"
          },
          "disclaimer": "Whether your knee tracks inward or outward of the hip-to-ankle line early in stance. Knee angles from a single camera can differ a lot from lab measurements (studies report 20\u00b0 or more), so treat this as a pattern, not a precise angle. Best used to spot side-to-side differences and changes between sessions."
        },
        "step_width": {
          "available": true,
          "value_pct": 50,
          "pattern": "typical",
          "window_pct": [
            0.0,
            47.6
          ],
          "cycles_used": 15,
          "ci95_pct": 0.0,
          "error_margin_pct": null,
          "confidence": {
            "score": 0.9,
            "tier": "moderate"
          },
          "disclaimer": "Where your foot lands relative to the middle of your body, as a share of your hip width. Below zero means the foot crosses the midline. Best used to spot side-to-side differences and changes between sessions."
        },
        "experimental": {
          "pronation": {
            "available": true,
            "value_deg": 8,
            "pattern": "neutral",
            "window_pct": [
              0.0,
              21.4
            ],
            "cycles_used": 15,
            "ci95_deg": 0.0,
            "error_margin_deg": null,
            "confidence": {
              "score": 0.9,
              "tier": "low"
            },
            "disclaimer": "A rough proxy from the angle of your ankle-to-heel line, which is short and hard to track from a phone camera. Treat it as a pattern, not an angle. Best used to spot side-to-side differences and changes between sessions."
          },
          "hip_drop": {
            "available": true,
            "value_deg": 10,
            "pattern": "pronounced",
            "window_pct": [
              0.0,
              47.6
            ],
            "cycles_used": 15,
            "ci95_deg": 0.0,
            "error_margin_deg": null,
            "confidence": {
              "score": 0.9,
              "tier": "moderate"
            },
            "disclaimer": "How far your pelvis dips on the swing side between foot strike and the lowest point of stance, from a rear-view video. Measured from your own foot strike, so a slightly tilted camera doesn't count. Best used to spot side-to-side differences and changes between sessions."
          }
        },
        "reportable": true
      }
    },
    "symmetry": {
      "available": true,
      "score": 86,
      "band": "symmetric",
      "components": {
        "knee_valgus": 72,
        "step_width": 100
      },
      "confidence": {
        "score": 0.9,
        "tier": "moderate"
      },
      "disclaimer": "Combines the rear-view patterns above, so it carries all of their uncertainty. Best used to spot side-to-side differences and changes between sessions."
    },
    "curves": {
      "step_pct": 5,
      "unit": "deg",
      "left": {
        "hip_drop_deg": [
          0.1,
          1.3,
          2.8,
          3.8,
          3.9,
          3.3,
          2.0,
          0.7,
          0.1,
          0.1,
          -0.9,
          -3.7,
          -7.6,
          -10.2,
          -10.7,
          -9.0,
          -5.3,
          -1.6,
          0.1,
          0.0,
          0.1
        ],
        "knee_valgus_deg": [
          4.7,
          4.5,
          4.5,
          4.5,
          4.5,
          4.5,
          4.5,
          4.6,
          4.9,
          5.4,
          6.1,
          7.0,
          8.0,
          8.8,
          8.9,
          8.4,
          7.4,
          6.5,
          5.6,
          5.0,
          4.7
        ]
      },
      "right": {
        "hip_drop_deg": [
          -0.0,
          1.9,
          5.8,
          9.3,
          10.8,
          10.1,
          7.3,
          3.3,
          0.5,
          -0.1,
          -0.1,
          -0.7,
          -2.1,
          -3.4,
          -3.9,
          -3.7,
          -2.7,
          -1.2,
          -0.2,
          -0.1,